Question,Choice A,Choice B,Choice C,Choice D,Correct Answer,Explanation
An object has ğ‘£ = âˆ’3 m/s and ğ‘ = âˆ’2 m/sÂ². What is happening to its speed?,It is slowing down,It is speeding up,It is at rest,It is moving in two dimensions,B,"When velocity and acceleration have the same sign (both negative), the object is speeding up."
An object has ğ‘£ = +5 m/s and ğ‘ = âˆ’2 m/sÂ². What is true about its motion?,Speeding up in the positive direction,Slowing down in the positive direction,Speeding up in the negative direction,Slowing down in the negative direction,B,Opposite signs for velocity and acceleration mean the object is slowing down.
"A ball is thrown straight up. At its highest point, what is ğ‘£áµ§ and ğ‘áµ§?","ğ‘£áµ§ = 0, ğ‘áµ§ = 0","ğ‘£áµ§ = 0, ğ‘áµ§ = âˆ’9.8 m/sÂ²","ğ‘£áµ§ = âˆ’9.8 m/s, ğ‘áµ§ = 0","ğ‘£áµ§ = âˆ’9.8 m/s, ğ‘áµ§ = âˆ’9.8 m/sÂ²",B,"At the peak, velocity is 0 but acceleration remains negative due to gravity."
An object moves left (âˆ’ğ‘¥) and slows down. Which must be true?,ğ‘£â‚â‚“â‚ < 0 and ğ‘â‚â‚“â‚ < 0,ğ‘£â‚â‚“â‚ < 0 and ğ‘â‚â‚“â‚ > 0,ğ‘£â‚â‚“â‚ > 0 and ğ‘â‚â‚“â‚ > 0,ğ‘£â‚â‚“â‚ > 0 and ğ‘â‚â‚“â‚ < 0,B,"If the object is slowing down while moving left, velocity is negative and acceleration is positive."
A runner has ğ‘£ = âˆ’6 m/s and ğ‘ = +2 m/sÂ². What is happening?,Runner is speeding up to the left,Runner is slowing down while moving left,Runner is stopped,Runner is speeding up to the right,B,Velocity and acceleration are opposite signs â†’ object slows down.
"If ğ‘ = 0 but ğ‘£ â‰  0, what does this tell us?",The object is speeding up,The object is slowing down,The object moves at constant speed,The object is not moving,C,Zero acceleration and nonzero velocity â†’ constant velocity motion.
Which situation describes an object speeding up?,"ğ‘£ = âˆ’4 m/s, ğ‘ = +2 m/sÂ²","ğ‘£ = 0 m/s, ğ‘ = âˆ’3 m/sÂ²","ğ‘£ = +2 m/s, ğ‘ = +2 m/sÂ²","ğ‘£ = +5 m/s, ğ‘ = âˆ’5 m/sÂ²",C,"When velocity and acceleration have the same sign, speed increases."
An object moves right (positive direction) and speeds up. Which is true?,ğ‘£ > 0 and ğ‘ > 0,ğ‘£ > 0 and ğ‘ < 0,ğ‘£ < 0 and ğ‘ > 0,ğ‘£ < 0 and ğ‘ < 0,A,Speeding up in the positive direction requires both velocity and acceleration positive.
An object is thrown downward with ğ‘£áµ§ = âˆ’10 m/s and falls faster. What must ğ‘áµ§ be?,ğ‘áµ§ = âˆ’9.8 m/sÂ²,ğ‘áµ§ = +9.8 m/sÂ²,ğ‘áµ§ = 0,ğ‘áµ§ = +10 m/sÂ²,A,Both velocity and acceleration downward = same sign â†’ speeding up.
"If ğ‘£ = âˆ’3 m/s and ğ‘ = 0, what will the object do?",Speed up in the negative direction,Slow down to a stop,Continue at constant speed,Change direction,C,"Acceleration of 0 means constant velocity, even if velocity is negative."
