Question,Choice A,Choice B,Choice C,Choice D,Correct Answer,Explanation
"A ball is thrown vertically upward at 8.0 m/s. Taking upward as positive, what is its velocity after 1.0 s?",2.0 m/s upward,2.0 m/s downward,18.0 m/s upward,18.0 m/s downward,B,"Use v = v₀ + a·t. Upward positive, a = -10 m/s². v = 8.0 + (-10)(1.0) = -2.0 m/s, or 2.0 m/s downward."
A car is traveling east at 20 m/s and experiences a westward acceleration of 3.0 m/s². How long does it take to stop?,5.0 s,6.7 s,3.0 s,8.0 s,A,Use v = v₀ + a·t with a = -3.0 m/s². 0 = 20 + (-3)t → t = 20/3 ≈ 6.7 s.
A skateboarder initially moves west at 5.0 m/s and then moves east at 2.0 m/s. What is the change in velocity?,3.0 m/s west,7.0 m/s east,7.0 m/s west,3.0 m/s east,B,Δv = v₍f₎ - v₍i₎ = 2.0 - (-5.0) = 7.0 m/s east.
An object falls from rest from a height of 50 m. What is its velocity just before impact if downward is positive and g = 10 m/s²?,10 m/s,20 m/s,30 m/s,40 m/s,D,Use v² = v₀² + 2aΔx. v² = 2(10)(50) = 1000 → v ≈ 32 m/s; approximating gives about 30-32 m/s downward.
A biker moves uphill at 12 m/s and slows down with an acceleration of -2.0 m/s². How far does the biker travel before stopping?,36 m,48 m,72 m,24 m,A,Use v² = v₀² + 2aΔx. 0 = 12² + 2(-2)Δx → Δx = 36 m.
An object is moving at 15 m/s to the right and accelerates leftward at 5 m/s². What is its velocity after 2.0 s?,5.0 m/s right,5.0 m/s left,25.0 m/s right,25.0 m/s left,A,Use v = v₀ + a·t. v = 15 + (-5)(2) = 5.0 m/s right.
"A runner moves west at 6.0 m/s, and the wind pushes them eastward with an acceleration of 1.0 m/s². How long until they stop?",3.0 s,4.0 s,5.0 s,6.0 s,B,Use v = v₀ + a·t. 0 = -6 + 1.0·t → t = 6.0 s.
A diver jumps off a cliff upward at 5.0 m/s. How long does it take before reaching maximum height?,0.5 s,1.0 s,2.0 s,5.0 s,B,At max height v = 0. Use v = v₀ + a·t → 0 = 5.0 + (-10)t → t = 0.5 s.
"A rock is thrown downward at 5.0 m/s from a cliff. Taking downward as positive, what is its speed after 2.0 s?",5.0 m/s,10.0 m/s,15.0 m/s,25.0 m/s,D,Use v = v₀ + a·t → v = 5.0 + 10(2) = 25.0 m/s.
A toy car is pushed to the right with an initial velocity of 2.0 m/s. It slows down with an acceleration of -0.5 m/s². How long until it stops?,2.0 s,3.0 s,4.0 s,5.0 s,C,Use v = v₀ + a·t → 0 = 2.0 + (-0.5)t → t = 4.0 s.
A ball is thrown straight up into the air. Which equation correctly describes its vertical velocity over time?,v² = v₀² + 2·a·t,v = v₀ + a·t,v = v₀ + a·x,v = a·t,B,"The correct equation is v = v₀ + a·t, which shows how velocity changes with time under constant acceleration."
A car accelerates uniformly from rest. Which equation gives the displacement after time t?,x = v₀ + ½·a·t²,x = v₀·t + a·t²,x = ½·a·t²,x = v₀·t + ½·a·t²,D,"The correct equation is x = v₀·t + ½·a·t², describing displacement when starting from rest with constant acceleration."
An object is dropped from rest. Which equation relates its velocity to displacement?,v² = v₀² + a·x,v = v₀ + 2·a·x,v² = v₀² + 2·a·x,v = √(2·a·x),C,"The correct equation is v² = v₀² + 2·a·x, relating velocity and displacement when starting from rest."
A runner increases speed with constant acceleration. Which equation gives the final velocity after displacement?,v = v₀ + a·t,v² = 2·a·x,v = v₀ + a·x,v² = v₀² + 2·a·Δx,D,"The correct equation is v² = v₀² + 2·a·Δx, linking final velocity, initial velocity, acceleration, and displacement."
"An object moves with constant acceleration. Which equation relates displacement to initial velocity, time, and acceleration?",x = ½·a·t²,x = x₀ + ½·a·t²,x = v₀·t + a·t²,x = x₀ + v₀·t + ½·a·t²,D,"The correct equation is x = x₀ + v₀·t + ½·a·t², combining initial position, initial velocity, time, and acceleration."
An object moves horizontally with constant velocity. Which equation correctly represents this motion?,x = x₀ + ½·a·t²,x = x₀ + v·t,x = v₀ + a·t,x = v₀·t + ½·a·t²,B,"The correct equation is x = x₀ + v·t, representing constant velocity motion without acceleration."
A projectile is launched horizontally from a cliff. Which equation gives its vertical displacement after time t?,y = y₀ + g·t,y = y₀ + v₀·t,y = y₀ + ½·g·t²,y = v₀·t + ½·g·t²,C,"The correct equation is y = y₀ + ½·g·t², describing vertical displacement under constant gravitational acceleration starting from rest."
"An object experiences a constant net force. Which equation correctly relates force, mass, and acceleration?",F = m·v,F = m/g,F = m·a,F = a/m,C,"The correct equation is F = m·a, Newton’s second law relating net force, mass, and acceleration."
A ball falls freely under gravity. Which equation gives the vertical position as a function of time?,y = y₀ + ½·a·t²,y = v₀·t + ½·g·t²,y = y₀ + v₀·t + ½·a·t²,y = y₀ + g·t²,C,"The correct equation is y = y₀ + v₀·t + ½·a·t², combining initial position, velocity, and constant acceleration over time."
"An object is moving with an initial velocity and constant acceleration. Which equation gives its velocity squared in terms of initial velocity, acceleration, and displacement?",v² = v₀ + a·x,v = v₀ + a·t,v² = v₀² + 2·a·Δx,v² = 2·a·x,C,"The correct equation is v² = v₀² + 2·a·Δx, linking velocity squared with displacement and acceleration."
A box slides down a ramp without friction. Which equation gives the component of gravitational force along the incline?,F = m·a,F = m·g·sinθ,F = m·g·cosθ,F = m·g,B,"The correct equation is F = m·g·sinθ, giving the component of gravity acting along a frictionless incline."
A planet orbits a star in a nearly circular path. Which equation gives the gravitational force between them?,F = G·(m₁²)/(r²),F = m₁·m₂/G·r²,F = G·r²/(m₁·m₂),F = G·(m₁·m₂)/r²,D,"The correct equation is F = G·(m₁·m₂)/r², describing the gravitational force between two masses separated by distance r."
An object swings as a pendulum at small angles. Which equation gives the restoring force?,F = m·g·r,F = -m·g·sinθ,F = m·g·cosθ,F = m·g·tanθ,B,"The correct equation is F = -m·g·sinθ, showing the restoring force for small-angle pendulum swings."
A spring is stretched by a mass. Which equation gives the restoring force of the spring?,F = k·x,F = k·x²,F = -k·x,F = -k·x²,C,"The correct equation is F = -k·x, Hooke's Law for the restoring force of a spring."
Two masses interact gravitationally. Which equation gives the gravitational force between them?,F = m₁·m₂/G·r²,F = G·(m₁·m₂)/r²,F = G·(m₁·m₂)/r,F = G·(m₁²)/r²,B,"The correct equation is F = G·(m₁·m₂)/r², describing gravitational attraction between two objects based on mass and distance."
A satellite moves in uniform circular motion around Earth. Which equation gives the required centripetal force?,F = m·a·r,F = m·r²/v,F = m·v/r,F = m·v²/r,D,"The correct equation is F = m·v²/r, giving the centripetal force needed for circular motion."
A car travels around a curve on a flat road. Which equation gives the maximum static friction force preventing slipping?,fₛ₍ₘₐₓ₎ = μₛ·N,fₛ₍ₘₐₓ₎ = μₖ·N,fₛ₍ₘₐₓ₎ = N/μₛ,fₛ₍ₘₐₓ₎ = μₛ/N,A,"The correct equation is fₛ₍ₘₐₓ₎ = μₛ·N, where μₛ is the coefficient of static friction and N is the normal force."
"A rotating object increases angular velocity. Which equation relates torque, moment of inertia, and angular acceleration?",τ = I·α,τ = α/I,τ = I/α,τ = α·I²,A,"The correct equation is τ = I·α, relating torque to moment of inertia and angular acceleration."
"An object moves in a circle. Which equation relates linear speed, radius, and centripetal acceleration?",a꜀ = v/r²,a꜀ = v²/r,a꜀ = v²·r,a꜀ = r²/v,B,"The correct equation is a꜀ = v²/r, defining centripetal acceleration for circular motion."
A disk spins at a constant angular velocity. Which equation relates angular displacement and angular velocity over time?,θ = ω²·t,θ = ω²·t²,θ = ω·t²,θ = ω·t,D,"The correct equation is θ = ω·t, giving angular displacement under constant angular velocity."
A ball is spun on a string in a circle. Which equation gives the angular velocity in terms of period?,ω = 2π·T,ω = T/2π,ω = 2π/T,ω = 2π/ω₀,C,"The correct equation is ω = 2π/T, relating angular velocity and period for uniform circular motion."
An object rotates with constant angular acceleration. Which equation gives final angular velocity?,ω = ω₀ + t/α,ω = ω₀·α·t,ω = α·t,ω = ω₀ + α·t,D,"The correct equation is ω = ω₀ + α·t, giving the final angular velocity under constant angular acceleration."
"A rotating wheel's angular velocity changes uniformly. Which equation relates angular displacement, angular velocity, and time?",θ = ω₀·t + ½·α·t²,θ = ω₀·t² + ½·α·t,θ = α·t²,θ = ½·ω₀·t²,A,"The correct equation is θ = ω₀·t + ½·α·t², relating angular displacement to time with constant angular acceleration."
A spinning object’s angular acceleration is known. Which equation gives its angular displacement?,θ = ω₀·t² + α·t²,θ = ½·ω₀·t,θ = ½·ω₀·t² + α·t,θ = ω₀·t + ½·α·t²,D,"The correct equation is θ = ω₀·t + ½·α·t², providing angular displacement under constant angular acceleration."
A solid sphere rolls without slipping. Which equation gives the condition for rolling without slipping?,v = ω/r,v = r·ω,v = ω²·r,v = r/ω,B,"The correct equation is v = r·ω, the rolling without slipping condition linking linear and angular velocity."
"A rotating object slows down under constant angular deceleration. Which equation relates final angular velocity, initial angular velocity, and angular displacement?",ω = ω₀ + α·t,ω = ω₀ + t/α,ω² = ω₀² + 2·α·θ,ω = α·t,C,"The correct equation is ω² = ω₀² + 2·α·θ, relating angular velocities and displacement under constant angular acceleration."
A spinning disk's final angular velocity is known. Which equation relates it to initial angular velocity and angular acceleration over angular displacement?,ω² = ω₀² + α·θ,ω = ω₀ + 2·α·t,ω² = ω₀² + 2·α·θ,ω² = 2·ω₀² + α·θ,C,"The correct equation is ω² = ω₀² + 2·α·θ, connecting angular velocity and displacement for rotating bodies."
A system's rotational kinetic energy is needed. Which equation gives rotational kinetic energy?,Kᵣₒₜ = ½·I·ω,Kᵣₒₜ = I·ω²,Kᵣₒₜ = I/ω²,Kᵣₒₜ = ½·I·ω²,D,"The correct equation is Kᵣₒₜ = ½·I·ω², giving rotational kinetic energy in terms of moment of inertia and angular velocity."
An object has both rotational and translational motion. Which equation gives the total kinetic energy?,K = m·v² + ½·I·ω²,K = m·v² + I·ω²,K = ½·m·v² + I·ω²,K = ½·m·v² + ½·I·ω²,D,"The correct equation is K = ½·m·v² + ½·I·ω², summing translational and rotational kinetic energy."
A uniform disk is rotating. Which equation gives its moment of inertia?,I = M²·R,I = ½·M·R²,I = M·R²,I = 2·M·R²,B,"The correct equation is I = ½·M·R², the moment of inertia for a uniform solid disk rotating about its center."
A system's mechanical energy includes both kinetic and potential terms. Which equation gives total mechanical energy?,E = K + U,E = K + U²,E = ½·K + U,E = K² + U,A,"The correct equation is E = K + U, combining kinetic and potential energy for total mechanical energy."
An object at height h above Earth’s surface has gravitational potential energy. Which equation gives this energy?,U = g·h,U = m²·g·h,U = m·g·h,U = m·g/h,C,"The correct equation is U = m·g·h, giving gravitational potential energy relative to a chosen reference height."
A compressed spring stores energy. Which equation gives the spring potential energy?,Uₛ = k·x²,Uₛ = k·x,Uₛ = ½·k·x,Uₛ = ½·k·x²,D,"The correct equation is Uₛ = ½·k·x², describing elastic potential energy stored in a spring compressed or stretched by distance x."
A force does work on an object. Which equation correctly gives work done when force is constant and parallel to displacement?,W = F/d,W = F²·d,W = F·d²,W = F·d,D,"The correct equation is W = F·d, giving work when a constant force acts parallel to displacement."
An object is lifted at constant velocity. Which equation gives the work done by the lifting force?,W = F·d,W = F²·d,W = F/d²,W = d·F²,A,"The correct equation is W = F·d, because the lifting force does work equal to force times vertical displacement at constant velocity."
A force is applied at an angle to displacement. Which equation correctly gives work in this situation?,W = F²·d·cosθ,W = F·d·cosθ,W = F·d·sinθ,W = F·d²·cosθ,B,"The correct equation is W = F·d·cosθ, accounting for the angle between force and displacement when calculating work."
An object gains kinetic energy when a net force acts on it. Which equation correctly states the work-energy theorem?,Wₙₑₜ = F·d,Wₙₑₜ = ΔU,Wₙₑₜ = ΔK,Wₙₑₜ = m·g·h,C,"The correct equation is Wₙₑₜ = ΔK, stating that net work done equals the change in kinetic energy."
An object moves through a distance under a variable force. Which equation gives the work done graphically?,Work = Area under F vs. d graph,Work = F/d,Work = d/F,Work = F·d²,A,"The correct method is calculating Work = Area under F vs. d graph, representing work done by a variable force."
A person lifts a box vertically with constant speed. Which equation gives gravitational work done by Earth?,W = m·g/d,W = F·d,W = m·g·d,W = -m·g·d,D,"The correct equation is W = -m·g·d, where work done by gravity is negative when lifting upward against gravitational force."
The power delivered by a constant force moving an object at constant speed is needed. Which equation gives this power?,P = v/F,P = F²·v,P = F·v,P = F/d,C,"The correct equation is P = F·v, expressing power as force times constant velocity."
A machine lifts a box at constant speed. Which equation correctly gives the mechanical power output?,P = F·v,P = v/F,P = F/v,P = F²·v,A,"The correct equation is P = F·v, giving mechanical power as force multiplied by constant velocity."
A spring stores potential energy. Which equation gives the force exerted by a spring when compressed?,F = -k·x,F = x/k,F = -k·x²,F = k·x²,A,"The correct equation is F = -k·x, Hooke's Law, giving spring force as proportional to displacement and opposite in direction."
An object experiences an impulse. Which equation gives impulse in terms of force and time?,J = Δt/F,J = F·Δt²,J = F/Δt,J = F·Δt,D,"The correct equation is J = F·Δt, defining impulse as force multiplied by the time interval."
An object's momentum changes. Which equation correctly relates impulse and change in momentum?,J = Δt/p,J = Δp,J = F/Δp,J = p/Δt,B,"The correct equation is J = Δp, connecting impulse to the change in momentum."
Two objects collide and stick together. Which principle applies to solve their final velocity?,Conservation of Energy,Conservation of Momentum,Conservation of Mass,Conservation of Force,B,"The correct principle is Conservation of Momentum, applying to perfectly inelastic collisions when objects stick together."
Fluid flows through a narrowing pipe. Which equation represents conservation of flow rate?,A₁·v₁ = v₂/A₂,A₁·v₁ = A₂·v₂,A₁·v₁ = A₂/v₂,A₁/v₁ = A₂/v₂,B,"The correct equation is A₁·v₁ = A₂·v₂, the continuity equation showing flow rate conservation in fluids."
The pressure at a depth in a fluid is needed. Which equation gives absolute pressure?,P = P₀ + h/ρg,P = P₀·ρ·g·h,P = ρ·g·h,P = P₀ + ρ·g·h,D,"The correct equation is P = P₀ + ρ·g·h, giving the absolute pressure at a depth in a fluid."
The buoyant force on a submerged object is needed. Which equation gives it?,F_b = ρ·V·g,F_b = ρ·g/V,F_b = ρ·g²·V,F_b = V·g/ρ,A,"The correct equation is F_b = ρ·V·g, expressing buoyant force based on fluid density and displaced volume."
An object is in orbit around a planet. Which equation gives its orbital speed?,v = √(GM·r),v = √(G·M/r),v = GM/r,v = r/√(GM),B,"The correct equation is v = √(G·M/r), giving orbital speed around a central mass."
The gravitational potential energy between two masses is needed. Which equation gives it?,U = -G·m₁·m₂/r,U = -G·m₁²·m₂/r,U = -G·m₁·m₂·r,U = G·m₁·m₂/r,A,"The correct equation is U = -G·m₁·m₂/r, giving gravitational potential energy between two masses."
An orbiting planet’s period and radius are related. Which law gives this relationship?,T² ∝ r²,T³ ∝ r²,T ∝ r³,T² ∝ r³,D,"Kepler’s third law states T² ∝ r³, relating orbital period and radius for planets."
A mass oscillates on a spring. Which equation gives the period of oscillation?,T = 2π·√(k/m),T = √(m/k),T = 2π·√(m/k),T = 2π·√(k·m),C,"The correct equation is T = 2π·√(m/k), giving the period of a mass-spring system."
A pendulum swings with small amplitude. Which equation gives its period?,T = 2π·√(g/L),T = 2π·√(L/g),T = √(L/g),T = 2π·L/g,B,"The correct equation is T = 2π·√(L/g), giving the period of a simple pendulum for small angles."
A force is applied at a distance from an axis of rotation. Which equation gives torque?,τ = r·F·cosθ,τ = r·F·sinθ,τ = r²·F,τ = F/r,B,"The correct equation is τ = r·F·sinθ, defining torque as force applied at a distance with an angle."
An object rotates with angular momentum. Which equation gives its angular momentum?,L = I/ω,L = ω²·I,L = I·ω,L = ω/I,C,"The correct equation is L = I·ω, defining angular momentum for rotating bodies."
A car moves 300 cm in 2 seconds. What is its speed in meters per second (m/s)?,v = 0.015 m/s,v = 150 m/s,v = 15 m/s,v = 1.5 m/s,D,"First convert 300 cm to meters: 300 cm ÷ 100 = 3 m. Then, speed = distance/time = 3 m ÷ 2 s = 1.5 m/s."
A mass of 2500 g is placed on a spring. What mass value should be used in calculations in SI units?,m = 25 kg,m = 2.5 kg,m = 0.25 kg,m = 250 kg,B,Grams must be converted to kilograms: 2500 g ÷ 1000 = 2.5 kg for correct SI unit usage.
A force is calculated as F = 10 kg × 2 m/s². What is the correct unit for force?,kg,m/s²,kg·m,N (newtons),D,"Force in SI units is expressed in newtons (N), where 1 N = 1 kg·m/s²."
An object travels 5 km. How many meters is this distance?,0.5 m,5000 m,500 m,50 m,B,"To convert kilometers to meters, multiply by 1000: 5 km × 1000 = 5000 m."
You calculate a speed as v = 4.2 but do not write any unit. What is missing?,m,m²/s,m/s,s,C,Velocity must be expressed with units of meters per second (m/s); omitting units is incorrect.
A measurement reads 1500 ms. What is this in seconds (s)?,150 s,1.5 s,15 s,0.15 s,B,Milliseconds must be converted to seconds: 1500 ms ÷ 1000 = 1.5 s.
A student finds the kinetic energy as 250 but forgets the unit. What unit should be written?,W (watts),N (newtons),kg,J (joules),D,Kinetic energy is measured in joules (J); forgetting to include the unit makes the answer incomplete.
Which unit correctly expresses work done in the SI system?,N (newtons),kg·m,J (joules),W (watts),C,"Work is measured in joules (J), not newtons or watts; watts measure power, not work."
A mass is given as 0.003 kg. What is this mass in grams (g)?,0.03 g,30 g,3 g,300 g,C,"To convert kilograms to grams, multiply by 1000: 0.003 kg × 1000 = 3 g."
Which of the following is the correct unit for pressure in the SI system?,Pa (pascals),W (watts),N (newtons),J (joules),A,"Pressure is measured in pascals (Pa), which equals N/m²."
"On a position vs. time graph, a straight line with a positive constant slope represents what type of motion?",Increasing acceleration,Constant positive velocity,Constant positive acceleration,Constant position,B,"On a position vs. time graph, the slope represents velocity. A straight line with positive constant slope means constant positive velocity."
"On a velocity vs. time graph, the slope of the line represents what quantity?",Velocity,Position,Displacement,Acceleration,D,"The slope of a velocity vs. time graph gives acceleration, not velocity or displacement."
What does the area under a velocity vs. time graph represent?,Velocity,Position,Displacement,Acceleration,C,"The area under a velocity vs. time graph gives displacement, while slope gives acceleration."
A flat horizontal line on a velocity vs. time graph means what?,Changing velocity,Constant acceleration,Constant velocity,Zero displacement,C,A flat line on a velocity vs. time graph indicates constant velocity because the value of velocity does not change with time.
"On a position vs. time graph, what does a curve getting steeper over time represent?",Constant acceleration,Increasing velocity,Decreasing displacement,Constant velocity,B,A steeper slope over time on a position vs. time graph means the object's velocity is increasing.
"On a velocity vs. time graph, a line with negative constant slope represents what?",Constant speed,Decreasing displacement,Constant negative acceleration,Constant negative velocity,C,A negative slope on a velocity vs. time graph means constant negative acceleration (deceleration).
"On an acceleration vs. time graph, a flat horizontal line above the time axis means what?",Constant positive velocity,Constant positive acceleration,Increasing acceleration,Zero acceleration,B,"A flat, positive line on an acceleration vs. time graph represents constant positive acceleration."
"On a position vs. time graph, a flat horizontal line represents what type of motion?",Constant positive acceleration,Constant positive velocity,Constant negative velocity,Zero velocity (object at rest),D,"A flat line on a position vs. time graph shows no change in position, meaning zero velocity (at rest)."
What does the area under an acceleration vs. time graph represent?,Change in acceleration,Change in velocity,Change in displacement,Change in position,B,The area under an acceleration vs. time graph gives the change in velocity.
"If the slope of a velocity vs. time graph is zero, what can we conclude?",Constant displacement,Constant velocity,Increasing velocity,Zero acceleration,B,Zero slope on a velocity vs. time graph means no change in velocity — constant velocity.
Solve for t from the equation v = v₀ + a·t.,t = v₀/a,t = v/a,t = (v - v₀)/a,t = v₀/v,C,"Starting from v = v₀ + a·t, subtract v₀ from both sides and divide by a: t = (v - v₀)/a."
Solve for v₀ from the equation x = v₀·t + ½·a·t².,v₀ = (x - a·t²)/t,v₀ = x/(½·a·t²),v₀ = (x - ½·a·t²)/t,v₀ = (x + ½·a·t²)/t,C,"Starting from x = v₀·t + ½·a·t², subtract ½·a·t² and divide by t to isolate v₀."
Solve for m from the equation F = m·a.,m = F - a,m = F/a,m = F/a²,m = F·a,B,"Starting from F = m·a, divide both sides by a to isolate m: m = F/a."
Solve for a from the equation v² = v₀² + 2·a·Δx.,a = (v² - v₀²)/(2·Δx),a = (v - v₀)/Δx,a = (v² + v₀²)/2Δx,a = (v² - v₀²)/(Δx),A,Subtract v₀² from both sides and divide by 2Δx: a = (v² - v₀²)/(2·Δx).
Solve for k from the equation Uₛ = ½·k·x².,k = ½·Uₛ/x,k = Uₛ/x²,k = 2·Uₛ/x,k = 2·Uₛ/x²,D,Multiply both sides by 2 and divide by x² to isolate k: k = 2·Uₛ/x².
Solve for F in the equation τ = r·F·sinθ.,F = τ/(r·sinθ),F = τ/r,F = τ·r·sinθ,F = τ/(r·cosθ),A,"Starting from τ = r·F·sinθ, divide both sides by (r·sinθ) to solve for F."
Solve for r from the equation F = G·(m₁·m₂)/r².,r = √(F/G·m₁·m₂),r = √(G·m₁·m₂/F),r = F/(G·m₁·m₂),r = (G·m₁·m₂)/F,B,"Multiply both sides by r², divide by F, then take the square root: r = √(G·m₁·m₂/F)."
Solve for v from the equation KE = ½·m·v².,v = √(2·KE/m),v = √(KE/2m),v = √(KE/m),v = KE/½m,A,"Multiply both sides by 2, divide by m, then take the square root: v = √(2·KE/m)."
Solve for h from the equation PE = m·g·h.,h = m·g/PE,h = PE/(m·g),h = PE/m,h = PE·g,B,Divide both sides by (m·g) to solve for h: h = PE/(m·g).
Solve for ω from the equation L = I·ω.,ω = L/I²,ω = L/I,ω = L·I,ω = I/L,B,Divide both sides by I to solve for ω: ω = L/I.
Solve for T from the equation T = 2π√(m/k).,T = 2π√(m/k),T = 2π(m/k),T = 2π·k/m,T = √(2π·m/k),A,T is already isolated. It is important to recognize that T = 2π√(m/k) without dropping the square root.
Solve for m from the equation T = 2π√(m/k).,m = (T²)/(2π·k),m = (T·k)/2π,m = (T²·k)/2π,m = (T²·k)/(4π²),D,"Square both sides, then solve for m: T² = (4π²m)/k, so m = (T²·k)/(4π²)."
Solve for a from the equation Δx = v₀·t + ½·a·t².,a = (Δx - v₀·t)/t²,a = (Δx)/(v₀·t²),a = (2(Δx - v₀·t))/t²,a = (2Δx - v₀·t)/t²,C,"Subtract v₀·t from both sides, multiply by 2, and divide by t² to isolate a."
Solve for Δx from the equation v² = v₀² + 2·a·Δx.,Δx = (v² - v₀²)/a,Δx = (v² - v₀²)/(2·a),Δx = (v - v₀)/(2a),Δx = (v² + v₀²)/2a,B,Subtract v₀² and divide by 2a to solve for Δx.
Solve for θ from the equation τ = r·F·sinθ.,θ = sin(τ/rF),θ = sin(τ)/(rF),θ = τ/(r·F),θ = sin⁻¹(τ/(r·F)),D,Divide by r·F and then take inverse sine: θ = sin⁻¹(τ/(r·F)).
Solve for v₀ from the equation v² = v₀² + 2·a·Δx.,v₀ = (v² - a·Δx)/2,v₀ = √(v² + 2·a·Δx),v₀ = v - 2·a·Δx,v₀ = √(v² - 2·a·Δx),D,"Subtract 2aΔx from v², then take the square root to solve for v₀."
Solve for g from the equation F_g = m·g.,g = F_g·m,g = F_g/m,g = F_g/m²,g = m/F_g,B,Divide both sides by m to solve for g: g = F_g/m.
