Question,Choice A,Choice B,Choice C,Choice D,Correct Answer,Explanation
Which condition shows an object slowing down?,ğ‘ = 0,"ğ‘£ < 0, ğ‘ < 0","ğ‘£ > 0, ğ‘ > 0","ğ‘£ > 0, ğ‘ < 0",D,Opposite signs for ğ‘£ and ğ‘ â†’ deceleration (slowing down).
"If ğ‘£ < 0 and ğ‘ > 0, what is happening?",Object is slowing down,Object is speeding up,Object is at rest,Object is turning,A,Velocity and acceleration in opposite directions = slowing down.
"If ğ‘£ = 0 and ğ‘ â‰  0, what happens next?",The object begins to move,The object slows to a stop,It stays motionless,Direction reverses,A,Acceleration causes motion from rest: object begins speeding up.
"When ğ‘ = 0, what is true about speed?",It decreases,It increases,It reverses,It stays constant,D,No acceleration â†’ no change in speed.
An object moving left slows down. What must ğ‘ be?,ğ‘ > 0,ğ‘ = 0,ğ‘ = v,ğ‘ < 0,A,Moving left (ğ‘£ < 0) and slowing means ğ‘ > 0.
Which pair implies speeding up motion?,"ğ‘£ = 0, ğ‘ = 0","ğ‘£ < 0, ğ‘ > 0","ğ‘£ > 0, ğ‘ > 0","ğ‘£ > 0, ğ‘ < 0",C,Same sign velocity and acceleration â†’ speeding up.
An object has constant acceleration but decreasing speed. What does this mean?,ğ‘ and ğ‘£ are aligned,ğ‘ opposes ğ‘£,ğ‘ = 0,The object is at rest,B,Decreasing speed under constant acceleration means opposite directions for ğ‘ and ğ‘£.
An object goes from 6 m/s to 2 m/s in 2 s. What is ğ‘?,0 m/sÂ²,2 m/sÂ²,âˆ’2 m/sÂ²,4 m/sÂ²,C,"ğ‘ = (2 âˆ’ 6)/2 = âˆ’2 m/sÂ², showing slowing down."
A ball slows from 10 m/s to 0 in 5 s. What is the acceleration?,âˆ’10 m/sÂ²,âˆ’2 m/sÂ²,2 m/sÂ²,0 m/sÂ²,B,ğ‘ = (0 âˆ’ 10)/5 = âˆ’2 m/sÂ² â†’ deceleration.
"If ğ‘ = âˆ’9.8 m/sÂ² and ğ‘£ = +5 m/s, what is happening?",It is moving backward,It is speeding up,It is falling faster,The object is slowing down,D,Acceleration opposite velocity â†’ object is slowing down.
